{
  "$schema": "../schemas/coverage-card.schema.json",
  "id": "mongo-mutable-record-store-integration",
  "title": "MongoMutableRecordStore Integration Tests",
  "status": "backlog",
  "category": "integration-test",
  "area": "mongo",
  "summary": "Exercise mutable-record CRUD and concurrency behavior against the local Mongo container.",
  "source": ["src/LagoVista.CloudStorage/Storage/StorageProviders/Mongo/MongoMutableRecordStore.cs"],
  "data": {"component":"MongoMutableRecordStore","testProject":"tests/LagoVista.StorageProvider.Tests","harness":"tests/LagoVista.StorageProvider.Tests/PowerShell/start-mongo-tests.ps1"}
}