{
  "$schema": "../schemas/coverage-card.schema.json",
  "id": "cassandra-session-factory-integration",
  "title": "CassandraSessionFactory Integration Tests",
  "status": "backlog",
  "category": "integration-test",
  "area": "cassandra",
  "summary": "Verify Cassandra session creation, keyspace connectivity, configuration, and failure behavior against the local Cassandra container.",
  "source": ["src/LagoVista.CloudStorage/Storage/StorageProviders/Cassandra/CassandraSessionFactory.cs"],
  "data": {"component":"CassandraSessionFactory","testProject":"tests/LagoVista.StorageProvider.Tests","harness":"tests/LagoVista.StorageProvider.Tests/PowerShell/start-cassandra-tests.ps1"}
}