{
  "$schema": "../schemas/coverage-card.schema.json",
  "id": "mongo-scratch-store-integration",
  "title": "MongoScratchStore Integration Tests",
  "status": "in-process",
  "category": "integration-test",
  "area": "scratch-data",
  "summary": "Exercise the Scratch Data contract and Mongo implementation against the local Mongo container, including upsert/query behavior and provider-owned TTL/index semantics.",
  "source": [
    "src/LagoVista.CloudStorage/Storage/StorageProviders/Mongo/MongoScratchStore.cs"
  ],
  "evidence": [
    ".coverage/evidence/scratch-data/latest.txt",
    ".coverage/evidence/scratch-data/latest.trx"
  ],
  "data": {
    "component": "MongoScratchStore",
    "contract": "IScratchStore",
    "testProject": "tests/LagoVista.StorageProvider.Tests",
    "test": "tests/LagoVista.StorageProvider.Tests/Mongo/MongoScratchStoreIntegrationTests.cs",
    "runner": "tests/LagoVista.StorageProvider.Tests/PowerShell/run-scratch-data-tests.ps1",
    "environment": { "type": "docker", "provider": "mongodb" },
    "coverage": [
      "upsert-insert-and-replace",
      "get",
      "filtering",
      "configured-indexes",
      "provider-owned-expiration-field",
      "mongo-ttl-index",
      "delete"
    ]
  }
}
