{
  "$schema": "../schemas/coverage-card.schema.json",
  "id": "mongo-document-storage-client-integration",
  "title": "MongoDocumentStorageClient Integration Tests",
  "status": "backlog",
  "category": "integration-test",
  "area": "document-storage",
  "summary": "Exercise the Mongo implementation of IDocumentStorageClient against the local Mongo container.",
  "source": [
    "src/LagoVista.CloudStorage/Storage/StorageProviders/Mongo/MongoDocumentStorageClient.cs"
  ],
  "data": {
    "component": "MongoDocumentStorageClient",
    "coverage": ["create-read-update-delete", "query", "patch", "optimistic-concurrency", "error-behavior"],
    "tests": [],
    "environment": { "type": "docker", "provider": "mongodb" }
  }
}
