{
  "$schema": "../schemas/coverage-card.schema.json",
  "id": "document-storage-client-parity",
  "title": "IDocumentStorageClient Cosmos/Mongo Parity",
  "status": "backlog",
  "category": "parity-test",
  "area": "document-storage",
  "summary": "Run equivalent contract-level behavior against Cosmos and Mongo to prove provider-neutral semantics.",
  "source": [
    "src/LagoVista.CloudStorage/Interfaces/StorageProviders/IDocumentStorageClient.cs",
    "src/LagoVista.CloudStorage/Storage/StorageProviders/CosmosDB/CosmosDocumentStorageClient.cs",
    "src/LagoVista.CloudStorage/Storage/StorageProviders/Mongo/MongoDocumentStorageClient.cs"
  ],
  "data": {
    "component": "IDocumentStorageClient",
    "coverage": ["create", "read", "update", "delete", "query", "patch", "optimistic-concurrency"],
    "tests": [],
    "environment": {
      "type": "multi-provider",
      "providers": ["cosmos-emulator", "mongodb"]
    }
  }
}
