{
  "id": "cosmos-document-storage-client-integration",
  "title": "CosmosDocumentStorageClient Integration Tests",
  "status": "backlog",
  "category": "integration-test",
  "area": "document-storage",
  "summary": "Exercise the Cosmos implementation of IDocumentStorageClient against the local Cosmos emulator.",
  "source": [
    "src/LagoVista.CloudStorage/Storage/StorageProviders/CosmosDB/CosmosDocumentStorageClient.cs"
  ],
  "data": {
    "component": "CosmosDocumentStorageClient",
    "coverage": [
      "create-read-update-delete",
      "query",
      "patch",
      "optimistic-concurrency",
      "error-behavior"
    ],
    "tests": [],
    "environment": {
      "type": "docker",
      "provider": "cosmos-emulator"
    }
  }
}
